{"$id":"https://martin-beck.github.io/agent-workflow-quality/schemas/python-refactor.schema.json","$schema":"https://json-schema.org/draft/2020-12/schema","additionalProperties":false,"properties":{"after":{"additionalProperties":false,"properties":{"path":{"maxLength":160,"pattern":"^[A-Za-z0-9_-]+(?:/[A-Za-z0-9_.-]+)*[.]py$","type":"string"},"sha256":{"pattern":"^[a-f0-9]{64}$","type":"string"}},"required":["path","sha256"],"type":"object"},"before":{"additionalProperties":false,"properties":{"path":{"maxLength":160,"pattern":"^[A-Za-z0-9_-]+(?:/[A-Za-z0-9_.-]+)*[.]py$","type":"string"},"sha256":{"pattern":"^[a-f0-9]{64}$","type":"string"}},"required":["path","sha256"],"type":"object"},"cases":{"items":{"additionalProperties":false,"properties":{"expected":{"maximum":1000000,"minimum":-1000000,"type":"integer"},"input":{"maximum":100,"minimum":-100,"type":"integer"}},"required":["input","expected"],"type":"object"},"maxItems":41,"minItems":3,"type":"array"},"mutants":{"items":{"additionalProperties":false,"properties":{"path":{"maxLength":160,"pattern":"^[A-Za-z0-9_-]+(?:/[A-Za-z0-9_.-]+)*[.]py$","type":"string"},"sha256":{"pattern":"^[a-f0-9]{64}$","type":"string"}},"required":["path","sha256"],"type":"object"},"maxItems":8,"minItems":1,"type":"array"},"owner":{"pattern":"^OWNER-[A-Z0-9]{4,32}$","type":"string"},"profile":{"const":"python-integer-function-v1"},"properties":{"const":["nondecreasing","odd","zero-preserving"]},"python_version":{"const":"3.12.14"},"review_sha256":{"pattern":"^[a-f0-9]{64}$","type":"string"},"schema_version":{"const":1},"tool_version":{"const":"1.0.0"}},"required":["schema_version","profile","tool_version","python_version","owner","review_sha256","before","after","mutants","cases","properties"],"title":"AWQ restricted Python refactoring collection v1","type":"object"}
