{"after":{"path":"after.py","sha256":"dd821cba26f470c3f37c5a6a0bc14783c48548f122b362f7fa7fb22279a83582"},"before":{"path":"before.py","sha256":"2de9325df9a8f0f2bc925bb63cbf0291eb2ae94e0ef5ea70f5febc0588fdfa13"},"cases":[{"expected":-4,"input":-2},{"expected":-2,"input":-1},{"expected":0,"input":0},{"expected":2,"input":1},{"expected":4,"input":2}],"mutants":[{"path":"mutant.py","sha256":"db25e0940315cfe70c164d7060126cf80701f7fb7ff76ad5532ae12012b987a3"}],"owner":"OWNER-DEMO","profile":"python-integer-function-v1","properties":["nondecreasing","odd","zero-preserving"],"python_version":"3.12.14","review_sha256":"aaaaaaaaaaaaaaaaaaaaaaaaaaaaaaaaaaaaaaaaaaaaaaaaaaaaaaaaaaaaaaaa","schema_version":1,"tool_version":"1.0.0"}
