{"after":{"path":"property-after.py","sha256":"ff42bba78784fb0f3fecafe2568a26fe402a0c41fa8383d573c5b0c5be31686c"},"before":{"path":"property-before.py","sha256":"0d6b382284b52cc0334d4eafa79d6cc602057a5ac36e17590d08de62f9dab12d"},"cases":[{"expected":4,"input":-2},{"expected":1,"input":-1},{"expected":0,"input":0},{"expected":1,"input":1},{"expected":4,"input":2}],"mutants":[{"path":"mutant.py","sha256":"db25e0940315cfe70c164d7060126cf80701f7fb7ff76ad5532ae12012b987a3"}],"owner":"OWNER-DEMO","profile":"python-integer-function-v1","properties":["nondecreasing","odd","zero-preserving"],"python_version":"3.12.14","review_sha256":"aaaaaaaaaaaaaaaaaaaaaaaaaaaaaaaaaaaaaaaaaaaaaaaaaaaaaaaaaaaaaaaa","schema_version":1,"tool_version":"1.0.0"}
